{
  "assets": {
    "receiver_sha256": "f47f71177f32bcd101b7573ec9171e6a57f4f4d31148d38e382306f42996874b",
    "sender_sha256": "6e6001da2106d4757498752a021df6c2bdc332c650aae4bae6b0c004dcf14933",
    "sidecar_sha256": "48caee80b31925a6074c9c5304bd861163f4e2e21adb55ebec9bf00237e2d990"
  },
  "image": {
    "reference": "docker.io/library/fpct-gpu-r2m:80fb295@sha256:0ea40657a38dbe8778ef492474f28ef2360156f4c9b0f8287e2bb0988d695851",
    "source_tree_sha256": "b2090b58362312384c330865b499080750eaf380eb071a2e44917e4ca28f6b51"
  },
  "kubernetes": {
    "config_map": "fpct-h1-dry-run-not-applied",
    "gpu_per_seed_pod": 2,
    "namespace": "c2c-research",
    "node_name": "4090-48gx2"
  },
  "manifest_sha256": "5e04fe7ffa2f5df6ed0159b67be88a1c9547f0cd11886d461166e1ce7ba455e4",
  "nested_confirmatory_manifest_sha256": "5e04fe7ffa2f5df6ed0159b67be88a1c9547f0cd11886d461166e1ce7ba455e4",
  "protocol_id": "fpct_cfm_harness_h1_candidate_lock_projection_v1",
  "run_uid": "h1-config-only-not-an-execution-uid",
  "schema_version": 1,
  "scientific_code_commit": "80fb295542ad298fae4cddb1273517b401bbcd17",
  "scientific_output": false,
  "shared_run_root": "H1_CONFIG_ONLY_NO_EXECUTION_ROOT",
  "source_lock_sha256": "db67428e6778c07a4991d9a9675ace6883de3a785c1f317b15b2aac7bfa0deff",
  "status": "H1_CONFIG_ONLY_CANDIDATE",
  "training": {
    "arm_order": {
      "45": [
        "c_pre",
        "c_post",
        "f"
      ],
      "46": [
        "c_pre",
        "f",
        "c_post"
      ],
      "47": [
        "c_post",
        "c_pre",
        "f"
      ],
      "48": [
        "c_post",
        "f",
        "c_pre"
      ],
      "49": [
        "f",
        "c_pre",
        "c_post"
      ],
      "50": [
        "f",
        "c_post",
        "c_pre"
      ],
      "51": [
        "c_pre",
        "c_post",
        "f"
      ],
      "52": [
        "c_pre",
        "f",
        "c_post"
      ],
      "53": [
        "c_post",
        "c_pre",
        "f"
      ],
      "54": [
        "c_post",
        "f",
        "c_pre"
      ],
      "55": [
        "f",
        "c_pre",
        "c_post"
      ],
      "56": [
        "f",
        "c_post",
        "c_pre"
      ]
    },
    "examples": 2048,
    "optimizer_steps": 64,
    "seeds": [
      45,
      46,
      47,
      48,
      49,
      50,
      51,
      52,
      53,
      54,
      55,
      56
    ],
    "world_size": 2
  },
  "training_authorized": false
}
